{
  "$schema": "./json-schemas/schema-validazione-form-onboarding-fonte-autentica.schema.json",
  "metadata": {
    "nome_ente_titolare": "Denominazione ente titolare (da compilare)",
    "nome_eaa": "Denominazione EAA (da compilare)",
    "data_compilazione": "",
    "versione": "0.6.0"
  },
  "casi_d_uso": {
    "target_utenti": {
      "documento_fisico_preesistente": {
        "domanda": "Il dataset è relativo a un documento fisico preesistente?",
        "suggerimento": "true (es. patente, titolo di studio); false",
        "risposta": false
      },
      "chi_puo_richiedere": {
        "domanda": "Chi può o potrà richiedere l'EAA relativa al dataset? Può ottenerla l'intera popolazione italiana o solo alcuni cittadini?",
        "suggerimento": "Solo maggiorenni residenti in una specifica regione",
        "risposta": ""
      },
      "prerequisiti": {
        "domanda": "Esistono prerequisiti per richiedere l'EAA relativa al dataset? Se sì, quali?",
        "suggerimento": "Necessario essere in possesso di altro documento, rispettare determinati criteri",
        "risposta": ""
      },
      "volume_rilascio": {
        "domanda": "Qual è il volume di rilascio del documento attuale?",
        "suggerimento": "200k Carte Europee della disabilità emesse in Italia",
        "risposta": ""
      },
      "limitazioni_estensioni": {
        "domanda": "L'EAA relativa al dataset potrà essere richiesta da tutti coloro che attualmente possono richiedere il documento oppure sono previste limitazioni e/o estensioni? Se sì, quali?",
        "suggerimento": "Ambito geografico; disponibilità limitata ai dati successivi a una determinata data",
        "risposta": ""
      }
    },
    "emissione_formato": {
      "dominio": {
        "domanda": "A quale dominio appartiene il dataset relativo all'EAA?",
        "suggerimento": "Istruzione, sanità",
        "risposta": ""
      },
      "interesse_pubblico": {
        "domanda": "L'EAA relativa al dataset è di interesse pubblico?",
        "suggerimento": "true",
        "risposta": false
      },
      "interesse_pubblico_motivazione": {
        "domanda": "Perché?",
        "suggerimento": "Rilasciato da ente pubblico, l’uso è richiesto o centrale per diritti/servizi di interesse generale, o per conformità/regolazione con impatto su terzi",
        "risposta": ""
      },
      "canali_richiesta": {
        "domanda": "Tramite quali canali il cittadino può ad oggi richiedere il documento?",
        "suggerimento": "Sportello fisico, portale online",
        "risposta": ""
      },
      "richieste_fisico_vs_digitale": {
        "domanda": "Se possibile richiederlo anche online, quante sono le richieste fatte tramite canale fisico e quante tramite canale digitale, all'interno di un arco temporale individuato negli ultimi 5 anni.",
        "suggerimento": "70% fisico, 30% digitale (ultimi 5 anni)",
        "risposta": ""
      },
      "formato_attuale": {
        "domanda": "In quale formato viene emesso ad oggi il documento? Card plastica, cartaceo, digitale?",
        "suggerimento": "Card plastica e versione digitale",
        "risposta": ""
      },
      "dettagli_digitale": {
        "domanda": "Se è già possibile ottenere il documento in formato digitale, fornisci dettagli sulle modalità di emissione",
        "suggerimento": "Scaricabile dal portale istituzionale in formato PDF",
        "risposta": ""
      },
      "possesso_documento": {
        "domanda": "Per ottenere l'EAA relativa al dataset sarà necessario essere già in possesso di un relativo documento fisico associabile al dataset?",
        "suggerimento": "true (es. è sufficiente aver concluso l'iter di richiesta); false",
        "risposta": false
      },
      "possesso_documento_condizioni": {
        "domanda": "Se sì, specificare motivazioni e condizioni",
        "suggerimento": "È sufficiente aver concluso l'iter di richiesta del documento",
        "risposta": ""
      },
      "catalogo_o_touchpoint": {
        "domanda": "L'utente potrà ottenere l'EAA relativa al dataset solo dal catalogo EAA del Wallet o anche da un touchpoint gestito dal tuo Ente?",
        "suggerimento": "Entrambi: catalogo e touchpoint Ente",
        "risposta": ""
      },
      "modalita_sincrona_differita": {
        "domanda": "L'utente potrà ottenere l'EAA relativa al dataset in modalità sincrona (preferibile) o in modalità differita? Se differita, perché?",
        "suggerimento": "Differita, per motivi di controlli aggiuntivi",
        "risposta": ""
      },
      "variazioni_dati": {
        "domanda": "Sono previste variazioni tra i dati dell'EAA relativa al dataset e i dati attualmente presenti nel documento? Se sì, quali e perché?",
        "suggerimento": "Disponibilità limitata di dati storici",
        "risposta": ""
      },
      "eaa_univoca": {
        "domanda": "È prevista un'EAA relativa al dataset univoca per ciascun soggetto o potranno essere emesse più EAA per lo stesso soggetto?",
        "suggerimento": "true per Una sola tessera sanitaria; false per molti titoli accademici",
        "risposta": true
      },
      "identificazione_utente": {
        "domanda": "Per fornire l'EAA relativa al dataset sarà necessario identificare l'utente?",
        "suggerimento": "true",
        "risposta": true
      },
      "identificazione_utente_motivazione": {
        "domanda": "Perché? Con quale mezzo?",
        "suggerimento": "Tramite Codice Fiscale/Carta Di Identità e riconoscimento de-visu",
        "risposta": ""
      }
    },
    "utilizzo": {
      "contesti_uso": {
        "domanda": "Quali sono (o saranno) i contesti d'uso dell'EAA relativa al dataset? Per cosa viene utilizzato?",
        "suggerimento": "Dimostrare possesso titoli professionali, accedere ad agevolazioni",
        "risposta": ""
      },
      "soggetti_verificatori": {
        "domanda": "Quali sono i principali soggetti che verificano (o verificheranno) l'EAA relativa al dataset?",
        "suggerimento": "Soggetti privati addetti alla sicurezza, operatori pubblici allo sportello",
        "risposta": ""
      },
      "verifica_validita": {
        "domanda": "Come è possibile verificare la validità del documento? QR code, Barcode, altri strumenti?",
        "suggerimento": "QR code, verifica de visu",
        "risposta": ""
      },
      "strumenti_verificatore": {
        "domanda": "Quali strumenti sono previsti da parte del verificatore per effettuare la verifica?",
        "suggerimento": "App per scan, verifica de visu",
        "risposta": ""
      },
      "utilizzo_continuo": {
        "domanda": "Il documento consente un utilizzo continuo o perde di validità non appena utilizzato?",
        "suggerimento": "Utilizzo continuo (tessera sanitaria); uso singolo (biglietto aereo)",
        "risposta": ""
      },
      "contesto_online_dal_vivo": {
        "domanda": "Il documento viene principalmente utilizzato online, dal vivo o in entrambi i contesti?",
        "suggerimento": "Entrambi: verifica presso sportelli e online",
        "risposta": ""
      },
      "tempo_validita": {
        "domanda": "Per quanto tempo è valido il documento? Validità uguale per tutti o variabile?",
        "suggerimento": "10 anni per tutti i cittadini",
        "risposta": ""
      },
      "rinnovo": {
        "domanda": "L'EAA relativa al dataset è rinnovabile?",
        "suggerimento": "true",
        "risposta": false
      },
      "rinnovo_procedura": {
        "domanda": "Se sì, cosa deve fare l'utente? Procedura digitale o uffici fisici?",
        "suggerimento": "Presso uffici territoriali o online",
        "risposta": ""
      },
      "validita_europa": {
        "domanda": "L'EAA relativa al dataset può essere utilizzata solo in Italia o anche in Europa?",
        "suggerimento": "Solo Italia / Anche in Europa",
        "risposta": ""
      },
      "limitazioni_territoriali": {
        "domanda": "Il documento è valido su tutto il territorio o esistono limitazioni?",
        "suggerimento": "Solo in alcune Regioni",
        "risposta": ""
      },
      "eaa_tutti_contesti": {
        "domanda": "Sarà possibile utilizzare l'EAA relativa al dataset in tutti i contesti in cui ad oggi è possibile utilizzare il documento?",
        "suggerimento": "true",
        "risposta": false
      },
      "eaa_tutti_contesti_dettaglio": {
        "domanda": "Se sì, quali contesti?",
        "suggerimento": "Contesti remoto e di prossimità",
        "risposta": ""
      },
      "estensione_contesti": {
        "domanda": "L'EAA relativa al dataset consentirà di estendere gli attuali contesti di utilizzo del documento?",
        "suggerimento": "true (es. nuovi casi d'uso per verifica remota)",
        "risposta": false
      },
      "estensione_contesti_dettaglio": {
        "domanda": "Se sì, quali estensioni?",
        "suggerimento": "Nuovi casi d'uso per verifica remota",
        "risposta": ""
      }
    },
    "pagamento": {
      "gratuito_o_pagamento": {
        "domanda": "L'EAA relativa al dataset è gratuita o prevede un pagamento a carico dell'utente?",
        "suggerimento": "true (Gratuito); false (Pagamento)",
        "risposta": false
      },
      "modalita_pagamento": {
        "domanda": "Se prevede un pagamento, quali sono le modalità consentite?",
        "suggerimento": "PagoPA, carta di credito",
        "risposta": ""
      },
      "pagamento_rinnovo": {
        "domanda": "Il rinnovo prevede un pagamento?",
        "suggerimento": "false",
        "risposta": false
      }
    },
    "legale_privacy": {
      "normativa": {
        "domanda": "Le modalità di emissione/presentazione dell'EAA relativa al dataset sono regolate da normativa?",
        "suggerimento": "D.Lgs. 82/2005, CAD",
        "risposta": ""
      },
      "proprieta_dati": {
        "domanda": "I dati sono di proprietà dell'ente o condivisi con altri enti? Quali?",